{
  "schema_version": "1.0",
  "challenge_id": "frontier-model-handoff-v0.1",
  "task_id": "repair-reset-domain-finding",
  "model": "example-only-not-a-model-result",
  "run_id": "example-001",
  "artifacts": {
    "before_report": "before-report.json",
    "after_report": "after-report.json"
  }
}
